plant_key,Name,Definition,Applications,Advantages,Usage,Precautions,Visit_url
Henna,Henna,"Henna (Lawsonia inermis) is a flowering plant native to North Africa, the Middle East, and South Asia. Its leaves are dried and ground into a powder to produce a natural dye used traditionally for body art and hair coloring.","Henna is used for temporary tattoos (mehndi), hair dyeing, cooling the body, and treating scalp conditions. It is also used in traditional medicine to relieve headaches, fevers, and skin irritations.","Henna has antifungal, antibacterial, and cooling properties. It strengthens hair, promotes scalp health, helps treat dandruff, and provides a natural, chemical-free coloring alternative.","The powdered leaves are mixed with water or other herbal infusions to make a paste, which is then applied to skin or hair. It is left on for a few hours before being washed off to leave a reddish-brown stain.","Only natural henna (greenish-brown) is safe for use. Black henna may contain harmful chemicals like PPD, which can cause allergic reactions or skin burns. A patch test is recommended before full application.",https://www.kew.org/plants/henna-tree
Mango,Mango,"Mango (Mangifera indica) is a tropical fruit-bearing tree native to South Asia, widely cultivated for its sweet, juicy fruit. It holds cultural, culinary, and medicinal importance in many parts of the world.","Mango is consumed fresh, in juices, smoothies, pickles, and desserts. Medicinally, it is used to improve digestion, support heart health, and boost immunity. Mango leaves and bark are used in traditional remedies for diabetes and oral health.","Mango is rich in vitamins A and C, antioxidants, and fiber. It promotes eye health, supports skin rejuvenation, aids digestion, and boosts immunity. The leaves also have antidiabetic and antimicrobial properties.",The ripe fruit is eaten fresh or processed into various products. The unripe fruit is used in pickles and chutneys. Mango leaves are used in decoctions for managing blood sugar and oral health issues.,Excess consumption of mango can lead to heat in the body or digestive discomfort. Diabetics should monitor their intake due to its natural sugar content. Mango latex (sap) may cause skin irritation in sensitive individuals.,https://en.wikipedia.org/wiki/Mangifera_indica
doddapatre,Doddapatre,"Doddapatre (Plectranthus amboinicus), commonly known as Indian Borage, is a herbaceous plant native to India and Southeast Asia. It has thick, fleshy leaves with a strong oregano-like scent and is used in traditional medicine and cooking.","Doddapatre is used to treat respiratory problems like cough and asthma, digestive issues, and as an anti-inflammatory agent. It is also used as a natural remedy for headaches, fever, and sore throat.","Doddapatre has antimicrobial, antifungal, and anti-inflammatory properties. It helps with digestion, boosts immunity, relieves respiratory conditions, and supports wound healing.","The leaves are consumed fresh or dried, typically as part of herbal teas, decoctions, or in culinary dishes. It is also applied topically for treating skin conditions like wounds and rashes.","Excessive consumption of Doddapatre may cause digestive discomfort. Pregnant women should consult a healthcare provider before using it medicinally, and it should be used in moderation to avoid any adverse reactions.",https://en.wikipedia.org/wiki/Plectranthus_amboinicus
doddpathre,Doddpathre,"Doddapatre (Plectranthus amboinicus), commonly known as Indian Borage, is a herbaceous plant native to India and Southeast Asia. It has thick, fleshy leaves with a strong oregano-like scent and is used in traditional medicine and cooking.","Doddapatre is used to treat respiratory problems like cough and asthma, digestive issues, and as an anti-inflammatory agent. It is also used as a natural remedy for headaches, fever, and sore throat.","Doddapatre has antimicrobial, antifungal, and anti-inflammatory properties. It helps with digestion, boosts immunity, relieves respiratory conditions, and supports wound healing.","The leaves are consumed fresh or dried, typically as part of herbal teas, decoctions, or in culinary dishes. It is also applied topically for treating skin conditions like wounds and rashes.","Excessive consumption of Doddapatre may cause digestive discomfort. Pregnant women should consult a healthcare provider before using it medicinally, and it should be used in moderation to avoid any adverse reactions.",https://en.wikipedia.org/wiki/Plectranthus_amboinicus
amruta_Balli,Amruta Balli,"Amruta Balli, scientifically known as *Tinospora cordifolia*, is a perennial climbing shrub native to India and Southeast Asia. Revered in Ayurvedic medicine, it is known for its potent immunomodulatory and therapeutic properties.","Amruta Balli is used to enhance immunity, treat fever, manage diabetes, detoxify the body, and support liver and kidney health. It is also utilized in managing respiratory issues, digestive disorders, and skin conditions.","The plant exhibits antioxidant, anti-inflammatory, antimicrobial, antipyretic, antidiabetic, hepatoprotective, and immunomodulatory effects. It is also known for its adaptogenic properties, helping the body combat stress and fatigue.","The stem and root extracts are commonly consumed in the form of powders, capsules, or decoctions. Fresh juice from the plant is also used. It is often combined with other herbs like Tulsi and Amla in traditional formulations.","Excessive consumption may lead to digestive discomfort. Pregnant and breastfeeding women should consult a healthcare provider before use. It is advisable to use under the guidance of a qualified practitioner, especially when combining with other medications.",https://en.wikipedia.org/wiki/Tinospora_cordifolia
amruthaballi,Amruthaballi,"Amruta Balli, scientifically known as *Tinospora cordifolia*, is a perennial climbing shrub native to India and Southeast Asia. Revered in Ayurvedic medicine, it is known for its potent immunomodulatory and therapeutic properties.","Amruta Balli is used to enhance immunity, treat fever, manage diabetes, detoxify the body, and support liver and kidney health. It is also utilized in managing respiratory issues, digestive disorders, and skin conditions.","The plant exhibits antioxidant, anti-inflammatory, antimicrobial, antipyretic, antidiabetic, hepatoprotective, and immunomodulatory effects. It is also known for its adaptogenic properties, helping the body combat stress and fatigue.","The stem and root extracts are commonly consumed in the form of powders, capsules, or decoctions. Fresh juice from the plant is also used. It is often combined with other herbs like Tulsi and Amla in traditional formulations.","Excessive consumption may lead to digestive discomfort. Pregnant and breastfeeding women should consult a healthcare provider before use. It is advisable to use under the guidance of a qualified practitioner, especially when combining with other medications.",https://en.wikipedia.org/wiki/Tinospora_cordifolia
betel_Nut,Betel Nut,"Betel Nut (Areca catechu) is the seed of the Areca palm, commonly chewed in many parts of Asia, particularly in India, along with betel leaves. It is known for its stimulating effects and is traditionally used for its medicinal, social, and cultural significance.","Betel Nut is used to improve digestion, enhance appetite, and stimulate the central nervous system. It is also used in some traditional remedies to treat oral diseases, respiratory conditions, and for its anti-inflammatory properties.","Betel Nut has stimulant properties, which can improve focus and mental clarity. It also has antiseptic and antimicrobial properties, helping to fight infections and treat oral conditions like gingivitis and bad breath.","Betel Nut is typically chewed in combination with betel leaves and slaked lime, though it can also be consumed in powdered or capsule form. It is often used in cultural rituals and as a mouth freshener.","Excessive consumption of Betel Nut is associated with several health risks, including an increased risk of oral cancer, addiction, and digestive issues. It should be used with caution, and prolonged use should be avoided. Pregnant women and children should not use Betel Nut.",https://en.wikipedia.org/wiki/Areca_nut
geranium,Geranium,"Geranium (Pelargonium spp.) is a genus of plants belonging to the family Geraniaceae, native to South Africa. Known for its fragrant leaves and colorful flowers, geranium is widely cultivated as an ornamental plant and is used for medicinal purposes.","Geranium is used to treat skin conditions like acne, eczema, and dermatitis. It is also used for its mood-boosting properties, to reduce anxiety, and as an antimicrobial agent. Geranium oil is widely used in aromatherapy for relaxation and stress relief.","Geranium has anti-inflammatory, antimicrobial, antiseptic, and astringent properties. It helps improve skin health, reduce stress, balance hormones, and support digestive health. It is also used to improve circulation and alleviate symptoms of PMS.","Geranium essential oil is used in aromatherapy, added to skin care products, or diluted for topical application. The leaves and flowers can also be used to make herbal teas or infusions for internal use.",Essential oils should be diluted before topical application to avoid skin irritation. Pregnant women and individuals with sensitive skin should consult a healthcare provider before use.,https://en.wikipedia.org/wiki/Pelargonium
rose,Rose,"Rose (Rosa spp.) is a genus of flowering plants in the family Rosaceae, known for its beautiful, fragrant flowers. Roses are native to temperate regions of the world, and they have been cultivated for ornamental, medicinal, and aromatic purposes for centuries.","Rose is used in skincare for its hydrating and anti-inflammatory properties. It is also used in aromatherapy to reduce stress and improve mood. Rose petals are used to prepare rose water, which has medicinal uses like soothing irritated skin and reducing inflammation.","Rose has antibacterial, antioxidant, and anti-inflammatory properties. It helps improve skin tone, reduce redness, and prevent signs of aging. Rose oil is also known for its calming effects, promoting emotional well-being and relaxation.","Rose petals are used to make rose water, which can be applied to the skin or consumed in drinks. Rose essential oil is used in aromatherapy, cosmetics, and massage. Fresh rose petals can also be added to teas for their soothing effects.",Rose oil should be diluted before topical application to avoid skin irritation. Pregnant women should consult a healthcare provider before using rose essential oil. People with allergies to plants in the Rosaceae family should perform a patch test first.,https://en.wikipedia.org/wiki/Rose
Rose,Rose,"Rose (Rosa spp.) is a genus of flowering plants in the family Rosaceae, known for its beautiful, fragrant flowers. Roses are native to temperate regions of the world, and they have been cultivated for ornamental, medicinal, and aromatic purposes for centuries.","Rose is used in skincare for its hydrating and anti-inflammatory properties. It is also used in aromatherapy to reduce stress and improve mood. Rose petals are used to prepare rose water, which has medicinal uses like soothing irritated skin and reducing inflammation.","Rose has antibacterial, antioxidant, and anti-inflammatory properties. It helps improve skin tone, reduce redness, and prevent signs of aging. Rose oil is also known for its calming effects, promoting emotional well-being and relaxation.","Rose petals are used to make rose water, which can be applied to the skin or consumed in drinks. Rose essential oil is used in aromatherapy, cosmetics, and massage. Fresh rose petals can also be added to teas for their soothing effects.",Rose oil should be diluted before topical application to avoid skin irritation. Pregnant women should consult a healthcare provider before using rose essential oil. People with allergies to plants in the Rosaceae family should perform a patch test first.,https://en.wikipedia.org/wiki/Rose
guava,Guava,"Guava (Psidium guajava) is a tropical fruit-bearing shrub native to Central America. It is known for its sweet and tangy flavor, and it is rich in vitamin C, antioxidants, and dietary fiber. The fruit and leaves have been used in traditional medicine for various health benefits.","Guava is used to support digestive health, boost immunity, and manage diabetes. Its leaves are traditionally used to treat diarrhea, infections, and inflammation. The fruit is consumed fresh, in juices, or used in cooking and jams.","Guava is packed with vitamins A, C, and E, which support immune function, skin health, and eye health. It also has antimicrobial, anti-inflammatory, and antioxidant properties. Guava aids in digestion, lowers blood sugar levels, and promotes heart health.","Guava fruit is eaten fresh, added to smoothies, or used in cooking. Guava leaves are used to make tea or extracts, which can be consumed for digestive and health benefits. Guava is also used in jams, juices, and preserves.","Overconsumption of guava may cause digestive discomfort, such as bloating or gas. Guava leaves should be used cautiously, especially in pregnant or breastfeeding women, as they may have mild medicinal effects. Always consult a healthcare provider before using medicinal extracts.",https://en.wikipedia.org/wiki/Guava
Gauva,Gauva,"Gauva (Psidium guajava) is a tropical fruit-bearing shrub native to Central America. It is known for its sweet and tangy flavor, and it is rich in vitamin C, antioxidants, and dietary fiber. The fruit and leaves have been used in traditional medicine for various health benefits.","Gauva is used to support digestive health, boost immunity, and manage diabetes. Its leaves are traditionally used to treat diarrhea, infections, and inflammation. The fruit is consumed fresh, in juices, or used in cooking and jams.","Gauva is packed with vitamins A, C, and E, which support immune function, skin health, and eye health. It also has antimicrobial, anti-inflammatory, and antioxidant properties. Guava aids in digestion, lowers blood sugar levels, and promotes heart health.","Gauva fruit is eaten fresh, added to smoothies, or used in cooking. Guava leaves are used to make tea or extracts, which can be consumed for digestive and health benefits. Guava is also used in jams, juices, and preserves.","Overconsumption of guava may cause digestive discomfort, such as bloating or gas. Guava leaves should be used cautiously, especially in pregnant or breastfeeding women, as they may have mild medicinal effects. Always consult a healthcare provider before using medicinal extracts.",https://en.wikipedia.org/wiki/Guava
hibiscus,Hibiscus,"Hibiscus (Hibiscus rosa-sinensis) is a flowering plant species in the family Malvaceae, native to tropical and subtropical regions of the world. It is widely cultivated for its vibrant flowers, which are used in traditional medicine and culinary applications.","Hibiscus is used to treat high blood pressure, cholesterol, and digestive problems. It is also used in skincare for its antioxidant and anti-inflammatory properties, promoting youthful skin and reducing redness and irritation.","Hibiscus is rich in antioxidants like anthocyanins, vitamin C, and flavonoids. It has antimicrobial, anti-inflammatory, and diuretic properties. Hibiscus is known to help lower blood pressure, manage cholesterol levels, and support heart health.","Hibiscus flowers are commonly used to make herbal tea, which is consumed to support heart health and reduce inflammation. The flowers can also be used topically in skincare products, and hibiscus extracts are included in hair care products for promoting hair health.","Hibiscus may lower blood pressure, so people with hypotension or those on blood pressure medications should use it with caution. Pregnant women should avoid consuming hibiscus tea as it may have uterine-stimulating effects. Always consult a healthcare provider before use.",https://en.wikipedia.org/wiki/Hibiscus
Hibiscus,Hibiscus,"Hibiscus (Hibiscus rosa-sinensis) is a flowering plant species in the family Malvaceae, native to tropical and subtropical regions of the world. It is widely cultivated for its vibrant flowers, which are used in traditional medicine and culinary applications.","Hibiscus is used to treat high blood pressure, cholesterol, and digestive problems. It is also used in skincare for its antioxidant and anti-inflammatory properties, promoting youthful skin and reducing redness and irritation.","Hibiscus is rich in antioxidants like anthocyanins, vitamin C, and flavonoids. It has antimicrobial, anti-inflammatory, and diuretic properties. Hibiscus is known to help lower blood pressure, manage cholesterol levels, and support heart health.","Hibiscus flowers are commonly used to make herbal tea, which is consumed to support heart health and reduce inflammation. The flowers can also be used topically in skincare products, and hibiscus extracts are included in hair care products for promoting hair health.","Hibiscus may lower blood pressure, so people with hypotension or those on blood pressure medications should use it with caution. Pregnant women should avoid consuming hibiscus tea as it may have uterine-stimulating effects. Always consult a healthcare provider before use.",https://en.wikipedia.org/wiki/Hibiscus
nithyapushpa,Nithyapushpa (Nithyakalyani),"Nithyapushpa, scientifically known as *Catharanthus roseus*, is an evergreen shrub native to Madagascar and widely cultivated in India and other tropical regions. It is known for its vibrant flowers and is used both ornamentally and medicinally.","Nithyapushpa is used to manage diabetes, hypertension, and certain cancers. It is also used in traditional medicine to treat wounds, infections, and as a general tonic. The plant is also utilized in ornamental gardening.","The plant contains alkaloids like vincristine and vinblastine, which are used in chemotherapy drugs. It has anti-inflammatory, antimicrobial, and antidiabetic properties. It also helps in wound healing and boosts immunity.","The whole plant is used in traditional medicine, either as a decoction or in powdered form. It is also used topically for wound care. The plant is cultivated for ornamental purposes in gardens and landscapes.","The plant contains toxic compounds and should be used under medical supervision. Overconsumption can lead to side effects such as nausea, vomiting, and low blood pressure. Pregnant and breastfeeding women should avoid using this plant.",https://en.wikipedia.org/wiki/Catharanthus_roseus
wood_sorel,Wood Sorel,"Wood Sorrel (Oxalis spp.) is a genus of flowering plants found worldwide, recognized by their trifoliate leaves and sour taste due to oxalic acid. Common species include Oxalis acetosella and Oxalis corniculata, often used in traditional medicine and culinary applications.","Traditionally used to treat digestive issues, fevers, mouth ulcers, and scurvy. Also applied topically for wounds and inflammation.","Rich in vitamin C and antioxidants; possesses diuretic, astringent, and anti-inflammatory properties.","Consumed as herbal tea, fresh leaves in salads, or applied as poultices for skin ailments.","High oxalic acid content may be harmful in large amounts, especially for individuals with kidney disorders. Use in moderation.",https://en.wikipedia.org/wiki/Oxalis
tamarind,Tamarind,"Tamarind (Tamarindus indica) is a leguminous tree native to tropical Africa but widely cultivated in India and other tropical regions. It is known for its edible, tangy fruit used in culinary, medicinal, and traditional practices.","Tamarind is used in traditional medicine to aid digestion, relieve constipation, and treat fever and sore throat. In culinary uses, it is a common ingredient in chutneys, sauces, and beverages. Medicinally, it is also used to manage bile disorders and act as a mild laxative.","Tamarind is rich in antioxidants, dietary fiber, and essential vitamins like B1, B3, and C. It exhibits anti-inflammatory, antimicrobial, and laxative properties. It helps improve digestion, reduce fever, and support heart and liver health.",Tamarind pulp is consumed directly or used in cooking. It is also used in herbal syrups and digestive tonics. The leaves and bark are used in traditional medicine for wound healing and inflammation. Tamarind water is often consumed to aid in digestion.,Overconsumption may cause acidity or interfere with certain medications like aspirin due to its blood-thinning properties. People with acid reflux or sensitive stomachs should moderate their intake. Diabetics should monitor blood sugar levels as tamarind may lower glucose.,https://en.wikipedia.org/wiki/Tamarind
brahmi,Brahmi,"Brahmi (Bacopa monnieri) is a creeping herb native to wetlands across India and Southeast Asia. It is a key herb in Ayurvedic medicine, valued for its powerful cognitive-enhancing and stress-relieving effects.","Brahmi is used to improve memory, concentration, and learning abilities. It is also applied in managing anxiety, stress, epilepsy, and Alzheimer�s disease. Traditionally, it has been used to support overall brain function and mental clarity.","Brahmi has neuroprotective, antioxidant, anti-inflammatory, and adaptogenic properties. It enhances cognitive performance, reduces cortisol levels, supports nervous system health, and helps with relaxation and mental rejuvenation.","Consumed as a supplement (capsule, powder, or syrup) or as an herbal tea. Brahmi oil is also massaged into the scalp to improve hair health and mental calmness. Aqueous extracts are used in Ayurvedic remedies.",Mild gastrointestinal symptoms like bloating or nausea may occur with high doses. It may interact with sedatives or thyroid medications. Pregnant and breastfeeding women should consult a doctor before use.,https://en.wikipedia.org/wiki/Bacopa_monnieri
bhrami,Brahmi,"Brahmi (Bacopa monnieri) is a creeping herb native to wetlands across India and Southeast Asia. It is a key herb in Ayurvedic medicine, valued for its powerful cognitive-enhancing and stress-relieving effects.","Brahmi is used to improve memory, concentration, and learning abilities. It is also applied in managing anxiety, stress, epilepsy, and Alzheimer�s disease. Traditionally, it has been used to support overall brain function and mental clarity.","Brahmi has neuroprotective, antioxidant, anti-inflammatory, and adaptogenic properties. It enhances cognitive performance, reduces cortisol levels, supports nervous system health, and helps with relaxation and mental rejuvenation.","Consumed as a supplement (capsule, powder, or syrup) or as an herbal tea. Brahmi oil is also massaged into the scalp to improve hair health and mental calmness. Aqueous extracts are used in Ayurvedic remedies.",Mild gastrointestinal symptoms like bloating or nausea may occur with high doses. It may interact with sedatives or thyroid medications. Pregnant and breastfeeding women should consult a doctor before use.,https://en.wikipedia.org/wiki/Bacopa_monnieri
sapota,Sapota,"Sapota (Manilkara zapota), also known as chikoo or sapodilla, is a tropical fruit-bearing tree native to southern Mexico, Central America, and the Caribbean. It is cultivated widely in India for its sweet and grainy-textured fruit.","Sapota is consumed as a fresh fruit and also used in milkshakes, desserts, and jams. In traditional medicine, it has been used to manage diarrhea, cough, and cold. The seeds and bark have astringent and anti-inflammatory applications.","Sapota is rich in dietary fiber, antioxidants, vitamins A and C, and minerals like iron and potassium. It helps improve digestion, boosts immunity, promotes skin health, and supports energy production due to its natural sugars.","The ripe fruit is eaten directly or used in desserts, smoothies, and ice creams. The latex of the plant has been used for dental purposes in the past. In traditional remedies, crushed seeds and bark extracts are sometimes applied topically.",Unripe fruit may cause mouth irritation or throat dryness. Excessive consumption of sapota may lead to weight gain due to its high sugar content. People with diabetes should monitor their intake. Always wash the fruit thoroughly before consumption.,https://en.wikipedia.org/wiki/Manilkara_zapota
basale,Basale (Malabar Spinach),"Basale, scientifically known as Basella alba, is a fast-growing, soft-stemmed vine native to the Indian subcontinent and Southeast Asia. Commonly referred to as Malabar Spinach, it is a popular leafy vegetable in tropical regions, known for its thick, fleshy leaves and mild flavor.","Basale is used in traditional medicine to treat digestive issues, skin conditions, and inflammation. It is also utilized for its cooling properties, making it beneficial in managing fevers and heat-related ailments. Additionally, it supports bone health and is used to enhance fertility and lactation.","Basale is rich in vitamins A and C, iron, calcium, and antioxidants. It exhibits anti-inflammatory, laxative, and demulcent properties. Regular consumption aids in digestion, boosts immunity, promotes healthy skin, and supports overall well-being.","The leaves and tender stems are consumed cooked in curries, soups, and stir-fries. They can also be eaten raw in salads. In traditional remedies, leaf paste is applied to wounds and burns, and leaf juice is consumed to alleviate digestive issues.","While Basale is generally safe for consumption, excessive intake may lead to digestive discomfort in some individuals. People with a history of kidney stones should consume it in moderation due to its oxalate content. Always consult a healthcare provider for personalized advice.",https://en.wikipedia.org/wiki/Basella_alba
